{
  "schemaVersion": 1,
  "domain": "agents",
  "generatedAt": "2026-08-06T11:26:08.409Z",
  "ok": true,
  "reason": null,
  "sources": [
    {
      "id": "canonical-agent-org-reader",
      "kind": "canonical-reader",
      "path": "src/lib/agent-org.js",
      "ok": true,
      "observedAt": "2026-08-06T10:12:27.418Z",
      "reason": null
    },
    {
      "id": "canonical-agent-org",
      "kind": "canonical-config",
      "path": "config/agent-org.json",
      "ok": true,
      "observedAt": "2026-08-06T10:12:47.927Z",
      "reason": null
    },
    {
      "id": "live-agent-preflight",
      "kind": "live-cli",
      "path": "tools/agent-preflight.js",
      "ok": true,
      "observedAt": "2026-08-06T11:26:08.461Z",
      "reason": null
    },
    {
      "id": "agent-presence-reader",
      "kind": "canonical-reader",
      "path": "src/lib/agent-presence.js",
      "ok": true,
      "observedAt": "2026-08-06T11:00:00.274Z",
      "reason": null
    },
    {
      "id": "agent-presence",
      "kind": "observed-registry",
      "path": "state/agent-presence.json",
      "ok": true,
      "observedAt": "2026-08-06T11:25:59.285Z",
      "reason": null
    },
    {
      "id": "state-store-reader",
      "kind": "durable-reader",
      "path": "src/lib/state-store.js",
      "ok": true,
      "observedAt": "2026-08-03T06:16:42.162Z",
      "reason": null
    }
  ],
  "data": {
    "revision": 17,
    "contentHash": "7b1397656f90d1648eb259c0b9adde7025d88cc2c607978e95faedbf005d7e12",
    "declared": [
      {
        "id": "coordinator-sol",
        "displayName": "Sol Coordinator",
        "role": "controller",
        "provider": "codex",
        "enabled": true,
        "assignedPhase": null,
        "phasePriority": [],
        "tasksDone": 0
      },
      {
        "id": "claude",
        "displayName": "Claude Code (shadow manager)",
        "role": "shadow-manager",
        "provider": "claude",
        "enabled": true,
        "assignedPhase": null,
        "phasePriority": [],
        "tasksDone": 0
      },
      {
        "id": "codex-manager-reconcile",
        "displayName": "Codex Manager - Reconcile DISABLED R1135",
        "role": "manager",
        "provider": "codex",
        "enabled": false,
        "assignedPhase": null,
        "phasePriority": [],
        "tasksDone": 0
      },
      {
        "id": "codex-manager-platform",
        "displayName": "Codex Manager - Platform and Topology DISABLED R1135",
        "role": "manager",
        "provider": "codex",
        "enabled": false,
        "assignedPhase": null,
        "phasePriority": [],
        "tasksDone": 0
      },
      {
        "id": "codex-manager-release",
        "displayName": "Codex Manager - V1 Release DISABLED R1135",
        "role": "manager",
        "provider": "codex",
        "enabled": false,
        "assignedPhase": null,
        "phasePriority": [],
        "tasksDone": 0
      },
      {
        "id": "codex-manager-deep-systems",
        "displayName": "Codex Manager - Deep Systems (Sol) DISABLED R1135",
        "role": "manager",
        "provider": "codex",
        "enabled": false,
        "assignedPhase": null,
        "phasePriority": [],
        "tasksDone": 0
      },
      {
        "id": "codex-manager-adjudication",
        "displayName": "Codex Manager - Design and Adjudication (Sol) DISABLED R1135",
        "role": "manager",
        "provider": "codex",
        "enabled": false,
        "assignedPhase": null,
        "phasePriority": [],
        "tasksDone": 0
      },
      {
        "id": "codex-manager-seat-1",
        "displayName": "Codex Manager Seat 1 (Sol R1135)",
        "role": "manager",
        "provider": "codex",
        "enabled": true,
        "assignedPhase": null,
        "phasePriority": [],
        "bornAt": 1786014109414,
        "origin": "self",
        "tasksDone": 2,
        "failRate": 0
      },
      {
        "id": "codex-manager-seat-2",
        "displayName": "Codex Manager Seat 2 (Sol R1135)",
        "role": "manager",
        "provider": "codex",
        "enabled": true,
        "assignedPhase": null,
        "phasePriority": [],
        "bornAt": 1786014898747,
        "origin": "self",
        "tasksDone": 0
      },
      {
        "id": "codex-manager-seat-3",
        "displayName": "Codex Manager Seat 3 (Sol R1135)",
        "role": "manager",
        "provider": "codex",
        "enabled": true,
        "assignedPhase": null,
        "phasePriority": [],
        "tasksDone": 0
      },
      {
        "id": "codex",
        "displayName": "Codex (subagent pool)",
        "role": "worker",
        "provider": "codex",
        "enabled": true,
        "assignedPhase": null,
        "phasePriority": [],
        "tasksDone": 0
      },
      {
        "id": "codex-assistant",
        "displayName": "Codex (coordinator assistant) DISABLED R1131",
        "role": "coordinator-assistant",
        "provider": "codex",
        "enabled": false,
        "assignedPhase": null,
        "phasePriority": [],
        "tasksDone": 0
      },
      {
        "id": "luna",
        "displayName": "Luna (Codex cheap tier)",
        "role": "builder",
        "provider": "codex",
        "enabled": true,
        "assignedPhase": null,
        "phasePriority": [],
        "tasksDone": 0
      },
      {
        "id": "terra",
        "displayName": "Terra (Codex mid tier)",
        "role": "builder",
        "provider": "codex",
        "enabled": true,
        "assignedPhase": null,
        "phasePriority": [],
        "tasksDone": 0
      },
      {
        "id": "sol",
        "displayName": "Sol (Codex high tier)",
        "role": "builder",
        "provider": "codex",
        "enabled": false,
        "assignedPhase": null,
        "phasePriority": [],
        "tasksDone": 0
      },
      {
        "id": "jarvis",
        "displayName": "JARVIS worker DISABLED R1131",
        "role": "worker",
        "provider": "local",
        "enabled": false,
        "assignedPhase": null,
        "phasePriority": [],
        "tasksDone": 0
      },
      {
        "id": "gemini",
        "displayName": "Gemini agentic worktree SUSPENDED R1131",
        "role": "builder",
        "provider": "gemini",
        "enabled": false,
        "assignedPhase": null,
        "phasePriority": [],
        "tasksDone": 0
      }
    ],
    "relationships": [
      {
        "from": "claude",
        "to": "coordinator-sol",
        "type": "reviews",
        "sourceKind": "declared"
      },
      {
        "from": "coordinator-sol",
        "to": "codex-manager-reconcile",
        "type": "manages",
        "sourceKind": "declared"
      },
      {
        "from": "coordinator-sol",
        "to": "codex-manager-platform",
        "type": "manages",
        "sourceKind": "declared"
      },
      {
        "from": "coordinator-sol",
        "to": "codex-manager-release",
        "type": "manages",
        "sourceKind": "declared"
      },
      {
        "from": "coordinator-sol",
        "to": "codex-manager-deep-systems",
        "type": "manages",
        "sourceKind": "declared"
      },
      {
        "from": "coordinator-sol",
        "to": "codex-manager-adjudication",
        "type": "manages",
        "sourceKind": "declared"
      },
      {
        "from": "codex-manager-deep-systems",
        "to": "coordinator-sol",
        "type": "escalates_to",
        "sourceKind": "declared"
      },
      {
        "from": "codex-manager-adjudication",
        "to": "coordinator-sol",
        "type": "escalates_to",
        "sourceKind": "declared"
      },
      {
        "from": "coordinator-sol",
        "to": "codex",
        "type": "manages",
        "sourceKind": "declared"
      },
      {
        "from": "coordinator-sol",
        "to": "luna",
        "type": "manages",
        "sourceKind": "declared"
      },
      {
        "from": "coordinator-sol",
        "to": "terra",
        "type": "manages",
        "sourceKind": "declared"
      },
      {
        "from": "coordinator-sol",
        "to": "sol",
        "type": "manages",
        "sourceKind": "declared"
      },
      {
        "from": "coordinator-sol",
        "to": "jarvis",
        "type": "manages",
        "sourceKind": "declared"
      },
      {
        "from": "coordinator-sol",
        "to": "gemini",
        "type": "manages",
        "sourceKind": "declared"
      },
      {
        "from": "coordinator-sol",
        "to": "codex-assistant",
        "type": "manages",
        "sourceKind": "declared"
      },
      {
        "from": "codex-manager-reconcile",
        "to": "coordinator-sol",
        "type": "escalates_to",
        "sourceKind": "declared"
      },
      {
        "from": "codex-manager-platform",
        "to": "coordinator-sol",
        "type": "escalates_to",
        "sourceKind": "declared"
      },
      {
        "from": "codex-manager-release",
        "to": "coordinator-sol",
        "type": "escalates_to",
        "sourceKind": "declared"
      },
      {
        "from": "codex",
        "to": "coordinator-sol",
        "type": "escalates_to",
        "sourceKind": "declared"
      },
      {
        "from": "terra",
        "to": "luna",
        "type": "reviews",
        "sourceKind": "declared"
      },
      {
        "from": "coordinator-sol",
        "to": "codex-manager-seat-1",
        "type": "manages",
        "sourceKind": "declared"
      },
      {
        "from": "codex-manager-seat-1",
        "to": "coordinator-sol",
        "type": "escalates_to",
        "sourceKind": "declared"
      },
      {
        "from": "coordinator-sol",
        "to": "codex-manager-seat-2",
        "type": "manages",
        "sourceKind": "declared"
      },
      {
        "from": "codex-manager-seat-2",
        "to": "coordinator-sol",
        "type": "escalates_to",
        "sourceKind": "declared"
      },
      {
        "from": "coordinator-sol",